{
  "schema_version": "1.2",
  "rule_set_id": "qz.carbon_accounting.software_policy",
  "kind": "SOFTWARE",
  "revision": "candidate-2026-10-17-r11",
  "base": "Review-only software policy; no production adoption.",
  "dependency": [
    {
      "rule_set_id": "qz.carbon_accounting.common.gbt_32150_2025",
      "revision": "main-204dded5-g05"
    }
  ],
  "status": "CANDIDATE",
  "groups": [],
  "adopts": [],
  "rules": [],
  "policies": [],
  "fields": [],
  "operations": [
    {
      "key": "review.operation.initialize_new_accounting",
      "operation_id": "initialize_new_accounting",
      "name": "新建核算页并初始化默认行",
      "initial_context": {
        "channel": "GUI",
        "object": "新建核算页中的空白项目工作区"
      },
      "action": "新建核算页时创建空白规范化输入草稿和默认行。只有明确确认新身份时才按NEW_SELECTION初始化；确认更换身份时按CONFIRMED_IDENTITY_CHANGE初始化；离开后重新选择时按RESELECT_AFTER_LEAVE初始化。按独立default_source策略确定唯一初始来源：FIXED只设置一个来源，NONE保持未选，PENDING保持待核。不按允许来源列表顺序推断默认来源，也不把参数数值缺省策略与初始来源混为一谈。",
      "changes": [
        "新工作区中的空白规范化输入和默认行",
        "仅当原因是NEW_SELECTION、CONFIRMED_IDENTITY_CHANGE或RESELECT_AFTER_LEAVE时，依据明确的default_source应用一个来源；NONE不自动选择，PENDING不初始化",
        "只有数值默认策略存在可用绑定时，才读取对应参数库参数；选择来源本身不复制参数值"
      ],
      "preserves": [
        "既有正式核算记录",
        "参数库及其来源绑定",
        "不属于新建/切换身份的既有行和草稿"
      ],
      "invalidates": [
        "重置时当前草稿及重复行按现有确认流程处理"
      ],
      "confirmation": [
        "关闭或重置时如存在未保存修改，遵循现有保存/放弃/取消流程",
        "只有明确确认了新身份后才初始化来源"
      ],
      "basis": [
        "packages/ui/carbon_material_page.py:CarbonMaterialAccountingPage.__init__",
        "packages/ui/carbon_material_page.py:CarbonMaterialAccountingPage._reset_for_new_accounting",
        "packages/application/project_workspaces.py:ProjectWorkspaceService.new_workspace",
        "PR46:packages/standards/carbon_material_input_policy.py:parameter_source_policy",
        "approved_plan:APPROVED_IMPLEMENTATION_V1_2#§7.1"
      ],
      "cases": [
        "tests/test_uat03_page.py::UAT03AccountingPageV2Tests.test_new_accounting_reset_keeps_one_row_per_energy_family",
        "tests/test_g06_page.py::G06PageTests.test_new_accounting_reset_removes_secondary_business_rows"
      ],
      "pending": [
        "A只定义初始化语义；当前main/PR46生产路径保持不变，后续实现需由项目负责人另行指示。"
      ],
      "rule_ids": []
    },
    {
      "key": "review.operation.edit_name_draft",
      "operation_id": "edit_name_draft",
      "name": "编辑尚未确认的名称草稿",
      "initial_context": {
        "channel": "GUI",
        "object": "燃料/物料名称编辑与确认控件"
      },
      "action": "编辑尚未确认的名称只更新显示名称草稿，不改变已确认的参数库身份，也不应用数值默认或default_source；不因每次按键、相同文本、失去焦点或刷新候选列表而清空参数或触发初始化。",
      "changes": [
        "尚未确认的显示名称和搜索草稿"
      ],
      "preserves": [
        "已确认的参数库身份、来源、数值、计量路径及来源草稿",
        "其他业务行和正式核算记录"
      ],
      "invalidates": [
        "已确认的规范化业务数据保持有效"
      ],
      "confirmation": [
        "正式核算前使用现有确认/取消交互处理未确认名称：确认新身份后进入switch_catalog_identity，确认仍为同一身份则进入confirm_same_catalog_identity；取消后仍显示并使用原已确认身份。",
        "不得显示未确认的新名称却按旧身份正式核算；不增加新的身份状态平台。"
      ],
      "basis": [
        "packages/ui/carbon_material_page.py:_FuelRow.fuel_type",
        "packages/ui/carbon_material_page.py:CarbonMaterialAccountingPage._on_fuel_type_changed",
        "PR46:packages/ui/name_selector.py:NameSelector.confirm_name",
        "packages/application/canonical_input_codec.py:encode_canonical_input"
      ],
      "cases": [
        "PR46:tests/test_pr46_fuel_confirmation.py::FuelConfirmationTests.test_typing_chinese_does_not_change_parameters_or_open_popup",
        "PR46:tests/test_pr46_fuel_confirmation.py::FuelConfirmationTests.test_project_restore_keeps_explicit_sources_values_and_pending_name"
      ],
      "pending": [
        "确认式名称草稿行为仅存在于PR46依赖分支，尚未合入main；A包不切生产。"
      ],
      "rule_ids": []
    },
    {
      "key": "review.operation.confirm_same_identity",
      "operation_id": "confirm_same_catalog_identity",
      "name": "重复确认同一参数库身份",
      "initial_context": {
        "channel": "GUI",
        "object": "已确认参数库身份的燃料行"
      },
      "action": "再次确认当前相同的参数库身份时，只更新确认或焦点状态；不重新应用数值默认或default_source，也不重置参数或计量方式。编辑名称、失去焦点或刷新候选列表同样不构成新身份选择。",
      "changes": [
        "只改变确认/焦点显示状态；业务数据不变"
      ],
      "preserves": [
        "已确认的参数库身份、实测值、当前来源、计量方式/路径、来源草稿和证据",
        "其他业务行及正式核算记录"
      ],
      "invalidates": [
        "不清空或重置当前参数、来源、计量方式或来源草稿；不替换数值来源证据"
      ],
      "confirmation": [
        "同身份确认、失去焦点和刷新候选列表都不是身份变更，不触发新建初始化。",
        "同身份确认不应用数值默认或default_source，不重置参数、单位、计量路径或来源草稿。"
      ],
      "basis": [
        "PR46:packages/ui/name_selector.py:NameSelector.confirm_name",
        "PR46:packages/ui/carbon_material_page.py:CarbonMaterialAccountingPage._on_fuel_type_changed",
        "历史PR46行为：重复确认曾按显式确认规则重置参数/计量基准；该事实只作旧行为依据，当前A目标按批准方案保留已确认Canonical数据。",
        "approved_plan:APPROVED_IMPLEMENTATION_V1_2#§7.1"
      ],
      "cases": [
        "tests/test_business_rules_candidate_revisions.py::CandidateRevisionExpectations.test_same_identity_target_preserves_confirmed_values_and_separates_old_behavior"
      ],
      "pending": [
        "这是A包的候选目标定义，不代表main或PR46控件已完成改造；后续变更仍待项目负责人指示。"
      ],
      "rule_ids": []
    },
    {
      "key": "review.operation.switch_catalog_identity",
      "operation_id": "switch_catalog_identity",
      "name": "确认切换参数库对象身份",
      "initial_context": {
        "channel": "GUI",
        "object": "具有参数库身份A及其参数依据的燃料行"
      },
      "action": "确认身份A切换到身份B，或离开已确认身份后重新选择时，分别按CONFIRMED_IDENTITY_CHANGE或RESELECT_AFTER_LEAVE执行新身份初始化。只采用新身份自身的实际参数解析器绑定、数值默认和default_source；同身份操作走confirm_same_catalog_identity，不沿用A的参数身份或数值。",
      "changes": [
        "将当前行已确认的参数库身份从A改为B",
        "按B的精确绑定重新确定参数值和初始来源；离开后重选时，对重选身份执行新的选择初始化",
        "来源为NONE时保持未选，PENDING时保持待核，不把允许来源列表首项当作默认来源"
      ],
      "preserves": [
        "其他业务行、未触及核算单元及正式核算记录",
        "旧身份绑定与历史来源证据仍可追溯，不重标为新身份来源"
      ],
      "invalidates": [
        "身份A特有的参数值、因子/参数身份、计量路径或选定来源不得转移到身份B",
        "离开身份A后的旧行草稿不得作为重选新身份的初始化值"
      ],
      "confirmation": [
        "必须明确确认身份B；离开身份A后重新选择也按该身份自身规则初始化",
        "离开后重选回原身份仍按RESELECT_AFTER_LEAVE初始化；未离开前重复确认同一身份不触发初始化"
      ],
      "basis": [
        "packages/ui/carbon_material_page.py:CarbonMaterialAccountingPage._on_fuel_type_changed",
        "packages/ui/carbon_material_page.py:CarbonMaterialAccountingPage._refresh_fuel_row",
        "packages/core/parameter_resolution.py:ParameterResolver.resolve",
        "approved_plan:APPROVED_IMPLEMENTATION_V1_2#§7.1"
      ],
      "cases": [
        "tests/test_uat03_formal_workflow.py::UAT03FormalWorkflowTests.test_catalog_manual_catalog_switch_freezes_actual_factor_without_borrowed_identity",
        "PR46:tests/test_pr46_fuel_confirmation.py::FuelConfirmationTests.test_new_confirmed_fuel_does_not_inherit_legacy_direct_source"
      ],
      "pending": [
        "A包仅登记目标转换语义；生产消费者尚未改造，后续实现需项目负责人另行指示。"
      ],
      "rule_ids": []
    },
    {
      "key": "review.operation.switch_source_isolated_draft",
      "operation_id": "switch_source_isolated_draft",
      "name": "按来源隔离并恢复参数草稿",
      "initial_context": {
        "channel": "GUI",
        "object": "来源可选为STANDARD_DEFAULT、CALCULATED或MEASURED的参数字段"
      },
      "action": "用户明确切换参数来源时，切到MEASURED/CALCULATED只恢复仍适用于同一参数对象、字段、单位和来源的有效草稿及证据；没有该来源草稿时留空待填，不把其他对象或单位的值挪来，也不把缺省值换标签。用户明确切回STANDARD_DEFAULT时，由现有Resolver按当前采用版本和完整核算上下文解析该对象/字段/单位的适用绑定并取绑定值；无适用绑定时明确提示缺少缺省绑定，不借用其他对象的绑定或补零。这是来源切换；新对象初始化、同身份确认和RESTORE各按各自操作处理。",
      "changes": [
        "当前字段的活动来源选择及其对应数值/依据草稿"
      ],
      "preserves": [
        "其他来源的既有草稿和证据",
        "参数库绑定身份及其他参数/业务行"
      ],
      "invalidates": [
        "原活动来源的值不再作为当前来源值参与本次计算，但仍保留为独立草稿"
      ],
      "confirmation": [
        "MEASURED/CALCULATED等目标来源须属于该字段在当前上下文中的source_qualification允许项；只恢复同对象、同字段、同单位、同来源的有效草稿，缺少草稿时不伪造值。",
        "显式切回STANDARD_DEFAULT时才按当前采用版本/上下文重新解析适用绑定；无绑定给出明确缺省不可用提示，不借值或补零。",
        "新身份首次初始化只由NEW_SELECTION、CONFIRMED_IDENTITY_CHANGE或RESELECT_AFTER_LEAVE相应规则触发；同身份确认和RESTORE不触发默认初始化。"
      ],
      "basis": [
        "PR46:packages/ui/carbon_material_page.py:CarbonMaterialAccountingPage._on_fuel_source_mode_changed",
        "PR46:packages/ui/carbon_material_page.py:CarbonMaterialAccountingPage._refresh_fuel_row",
        "PR46:packages/standards/carbon_material_input_policy.py:parameter_source_policy"
      ],
      "cases": [
        "PR46:tests/test_pr46_fuel_confirmation.py::FuelConfirmationTests.test_source_switch_retains_separate_manual_drafts_without_relabeling_defaults",
        "PR46:tests/test_pr46_fuel_confirmation.py::FuelConfirmationTests.test_catalog_fch_explicit_source_editability_and_restore_default_evidence",
        "PR46:tests/test_pr46_parameter_source_policy.py::ParameterSourcePolicyTests.test_fuel_source_choices_are_field_and_origin_specific"
      ],
      "pending": [
        "各来源草稿隔离目前仅见于PR46路径，尚未合入main。"
      ],
      "rule_ids": []
    },
    {
      "key": "review.operation.change_fuel_path_unit",
      "operation_id": "change_fuel_path_unit",
      "name": "切换燃料计量路径或单位",
      "initial_context": {
        "channel": "GUI",
        "object": "燃料输入路径与含碳量/热值计量基准"
      },
      "action": "用户更换燃料计量路径或质量/体积单位时，重新确定适用于新路径的参数身份和单位；不静默换算旧路径值，也不冒充新路径默认值。DIRECT路径使用fuel.direct_carbon字段在当前对象、路径和单位下由该字段source_qualification允许的单位质量/体积直接含碳量，不重复乘低位发热量或FCh。使用FCh的热值计算路径按质量或体积活动量经低位发热量换算。此操作与重复确认同一身份不同，本候选不增设HEAT活动量入口。",
      "changes": [
        "当前燃料计量路径、活动量单位，以及该路径对应的含碳量/LHV/FCh参数语义"
      ],
      "preserves": [
        "用户原始活动量字面值及其原单位证据",
        "同路径来源草稿和其他业务行"
      ],
      "invalidates": [
        "与新路径不兼容的当前参数选择/校验结果；不删除隔离的来源草稿"
      ],
      "confirmation": [
        "用户明确切换计量路径或单位；如同时改变对象身份，先处理新身份初始化"
      ],
      "basis": [
        "packages/standards/carbon_material.py:FuelInput.__post_init__",
        "packages/ui/carbon_material_page.py:CarbonMaterialAccountingPage._on_fuel_basis_changed",
        "packages/ui/carbon_material_page.py:CarbonMaterialAccountingPage._recommended_fuel_activity_path"
      ],
      "cases": [